data/price_cache/CRWV_2025-12-04_2026-06-16.json

[{"date": "2025-12-04", "o": 79.185, "c": 85.75, "h": 88.375, "l": 77.86, "v": 29382948.0}, {"date": "2025-12-05", "o": 87.3, "c": 88.3, "h": 88.76, "l": 84.62, "v": 20076811.0}, {"date": "2025-12-08", "o": 83.65, "c": 86.24, "h": 87, "l": 80.145, "v": 39915874.0}, {"date": "2025-12-09", "o": 84.52, "c": 90.66, "h": 91.22, "l": 83.77, "v": 34362163.0}, {"date": "2025-12-10", "o": 88.435, "c": 88.16, "h": 89.7899, "l": 85.35, "v": 26553865.0}, {"date": "2025-12-11", "o": 83.01, "c": 87.38, "h": 88.53, "l": 81.1, "v": 26922845.0}, {"date": "2025-12-12", "o": 86.19, "c": 78.59, "h": 87.6999, "l": 77.66, "v": 35221384.0}, {"date": "2025-12-15", "o": 79.33, "c": 72.35, "h": 79.74, "l": 72.02, "v": 31357605.0}, {"date": "2025-12-16", "o": 70.7, "c": 69.5, "h": 71.5, "l": 67.75, "v": 36004023.0}, {"date": "2025-12-17", "o": 69.55, "c": 64.55, "h": 69.9897, "l": 63.8, "v": 48237253.0}, {"date": "2025-12-18", "o": 67.445, "c": 67.68, "h": 68.94, "l": 65.8661, "v": 34161555.0}, {"date": "2025-12-19", "o": 70.86, "c": 83, "h": 84.29, "l": 70.73, "v": 70583043.0}, {"date": "2025-12-22", "o": 84.99, "c": 84.83, "h": 87.31, "l": 84.18, "v": 23984263.0}, {"date": "2025-12-23", "o": 82.28, "c": 80.26, "h": 83.71, "l": 78.7, "v": 22239750.0}, {"date": "2025-12-24", "o": 80.07, "c": 78.87, "h": 80.94, "l": 78.55, "v": 11922598.0}, {"date": "2025-12-26", "o": 79, "c": 76.42, "h": 79.29, "l": 75.73, "v": 14073499.0}, {"date": "2025-12-29", "o": 73.54, "c": 74.92, "h": 77.75, "l": 73.4, "v": 14033053.0}, {"date": "2025-12-30", "o": 74.755, "c": 73.9, "h": 75.8616, "l": 73.65, "v": 13291778.0}, {"date": "2025-12-31", "o": 73.49, "c": 71.61, "h": 73.675, "l": 70.43, "v": 18122831.0}, {"date": "2026-01-02", "o": 73.93, "c": 79.32, "h": 81.17, "l": 73.16, "v": 30050016.0}, {"date": "2026-01-05", "o": 82.9, "c": 76.86, "h": 84.54, "l": 76.77, "v": 27206462.0}, {"date": "2026-01-06", "o": 78.65, "c": 77.94, "h": 78.84, "l": 73.75, "v": 25473266.0}, {"date": "2026-01-07", "o": 77.14, "c": 77.18, "h": 79.94, "l": 75.75, "v": 14413401.0}, {"date": "2026-01-08", "o": 77.575, "c": 77.09, "h": 79.9299, "l": 75.91, "v": 20472247.0}, {"date": "2026-01-09", "o": 78.32, "c": 80.14, "h": 81.5, "l": 75.51, "v": 26303232.0}, {"date": "2026-01-12", "o": 78.75, "c": 89.93, "h": 91.94, "l": 77.81, "v": 43610479.0}, {"date": "2026-01-13", "o": 89.05, "c": 87.48, "h": 91.5, "l": 86.86, "v": 20414056.0}, {"date": "2026-01-14", "o": 89.2, "c": 89.8, "h": 93.18, "l": 86.5, "v": 28378258.0}, {"date": "2026-01-15", "o": 94.73, "c": 95.01, "h": 99.73, "l": 94.25, "v": 40670384.0}, {"date": "2026-01-16", "o": 97.32, "c": 101.23, "h": 102.9793, "l": 95.75, "v": 34781378.0}, {"date": "2026-01-20", "o": 95.3, "c": 95.22, "h": 97.37, "l": 93.13, "v": 26822540.0}, {"date": "2026-01-21", "o": 95.395, "c": 94.05, "h": 95.92, "l": 87.25, "v": 29676614.0}, {"date": "2026-01-22", "o": 97.52, "c": 91.79, "h": 99.47, "l": 91.57, "v": 19946388.0}, {"date": "2026-01-23", "o": 90.45, "c": 92.98, "h": 95.98, "l": 87.07, "v": 20374955.0}, {"date": "2026-01-26", "o": 102, "c": 98.31, "h": 108.65, "l": 98.05, "v": 49348962.0}, {"date": "2026-01-27", "o": 103.7, "c": 108.86, "h": 111.79, "l": 101.86, "v": 49218762.0}, {"date": "2026-01-28", "o": 114.155, "c": 106.02, "h": 114.45, "l": 102.64, "v": 36455558.0}, {"date": "2026-01-29", "o": 103.86, "c": 99.53, "h": 106.4399, "l": 96.1, "v": 30885933.0}, {"date": "2026-01-30", "o": 99, "c": 93.19, "h": 99.5, "l": 92.5001, "v": 25314890.0}, {"date": "2026-02-02", "o": 92.835, "c": 88.94, "h": 94.7699, "l": 88.52, "v": 19489110.0}, {"date": "2026-02-03", "o": 91.02, "c": 90.06, "h": 92.1199, "l": 83.93, "v": 25101357.0}, {"date": "2026-02-04", "o": 89.55, "c": 82.46, "h": 91.95, "l": 81.01, "v": 26247809.0}, {"date": "2026-02-05", "o": 79.65, "c": 74.65, "h": 81.97, "l": 74, "v": 23637671.0}, {"date": "2026-02-06", "o": 77.9, "c": 89.95, "h": 90.6, "l": 77.1, "v": 36852754.0}, {"date": "2026-02-09", "o": 90.07, "c": 96.79, "h": 97.94, "l": 88.7, "v": 25424406.0}, {"date": "2026-02-10", "o": 95, "c": 95.11, "h": 97.29, "l": 93.8, "v": 14088159.0}, {"date": "2026-02-11", "o": 95.82, "c": 95.15, "h": 97.77, "l": 88.53, "v": 21192299.0}, {"date": "2026-02-12", "o": 94.265, "c": 95.7, "h": 97.5, "l": 90.33, "v": 20441449.0}, {"date": "2026-02-13", "o": 94.28, "c": 96.04, "h": 100.69, "l": 91, "v": 23116988.0}, {"date": "2026-02-17", "o": 92.69, "c": 91, "h": 95.4599, "l": 89.09, "v": 17482204.0}, {"date": "2026-02-18", "o": 91.085, "c": 95.45, "h": 97.29, "l": 87.5, "v": 17481824.0}, {"date": "2026-02-19", "o": 95.285, "c": 97.14, "h": 98.29, "l": 93.51, "v": 10807572.0}, {"date": "2026-02-20", "o": 93.56, "c": 89.25, "h": 93.675, "l": 84.5, "v": 46366165.0}, {"date": "2026-02-23", "o": 87.36, "c": 90.84, "h": 93.39, "l": 86.57, "v": 21774808.173283}, {"date": "2026-02-24", "o": 91.06, "c": 99.3, "h": 99.37, "l": 90.6863, "v": 24587573.575591}, {"date": "2026-02-25", "o": 100.98, "c": 98.01, "h": 103.44, "l": 97.85, "v": 20880987.790244}, {"date": "2026-02-26", "o": 98.85, "c": 97.63, "h": 100.75, "l": 95.02, "v": 27329418.763122}, {"date": "2026-02-27", "o": 84.22, "c": 79.56, "h": 84.38, "l": 75.66, "v": 67921276.907591}, {"date": "2026-03-02", "o": 76.61, "c": 78.05, "h": 80.33, "l": 75.6, "v": 25514169.380676}, {"date": "2026-03-03", "o": 75.23, "c": 73.78, "h": 75.3699, "l": 70.37, "v": 24549363.338825}, {"date": "2026-03-04", "o": 77.8, "c": 79.5, "h": 80.66, "l": 75.8, "v": 25322759.81506}, {"date": "2026-03-05", "o": 77, "c": 74.82, "h": 78.68, "l": 73.25, "v": 22667512.42149}, {"date": "2026-03-06", "o": 72.95, "c": 72.99, "h": 77.9497, "l": 71.85, "v": 25591588.965981}, {"date": "2026-03-09", "o": 71.54, "c": 74.41, "h": 74.5, "l": 70.7, "v": 21551455.905529}, {"date": "2026-03-10", "o": 75.02, "c": 74.92, "h": 75.92, "l": 73.75, "v": 16449259.852953}, {"date": "2026-03-11", "o": 79, "c": 81.96, "h": 82.99, "l": 77.86, "v": 33672129.897641}, {"date": "2026-03-12", "o": 79.63, "c": 79.86, "h": 82.38, "l": 78.4, "v": 16174676.443788}, {"date": "2026-03-13", "o": 81.07, "c": 81.11, "h": 84.44, "l": 79.46, "v": 17700719.913591}, {"date": "2026-03-16", "o": 85.87, "c": 85.86, "h": 88.26, "l": 81.88, "v": 25842506.467679}, {"date": "2026-03-17", "o": 83.98, "c": 82.12, "h": 85.1, "l": 81.56, "v": 17332108.649205}, {"date": "2026-03-18", "o": 80.71, "c": 82.82, "h": 85.28, "l": 80.04, "v": 17332834.119154}, {"date": "2026-03-19", "o": 80, "c": 80.66, "h": 81.6, "l": 78.78, "v": 19522350.742046}, {"date": "2026-03-20", "o": 80.14, "c": 81.47, "h": 83.15, "l": 77.58, "v": 29378469.929567}, {"date": "2026-03-23", "o": 81.8, "c": 81.96, "h": 85.34, "l": 80.31, "v": 19755833.720762}, {"date": "2026-03-24", "o": 82.93, "c": 83.02, "h": 84.5, "l": 80.1, "v": 21682537.756707}, {"date": "2026-03-25", "o": 85.23, "c": 87.58, "h": 88.75, "l": 84.85, "v": 19101590.197713}, {"date": "2026-03-26", "o": 86.85, "c": 80.45, "h": 88.26, "l": 80.16, "v": 18464596.012049}, {"date": "2026-03-27", "o": 78.41, "c": 74.81, "h": 79.4, "l": 73.22, "v": 22244316.182498}, {"date": "2026-03-30", "o": 75.31, "c": 69.15, "h": 75.46, "l": 67.1501, "v": 27315935.555121}, {"date": "2026-03-31", "o": 73, "c": 77.47, "h": 77.59, "l": 72.42, "v": 27917130.597165}, {"date": "2026-04-01", "o": 79.49, "c": 78.44, "h": 80.5399, "l": 76.8, "v": 28569049.757749}, {"date": "2026-04-02", "o": 75.76, "c": 82.24, "h": 82.5, "l": 73.81, "v": 20958230.35923}, {"date": "2026-04-06", "o": 81.33, "c": 80.94, "h": 82.29, "l": 79.56, "v": 16946863.821061}, {"date": "2026-04-07", "o": 80.18, "c": 85.24, "h": 85.3, "l": 80.135, "v": 16277315.307881}, {"date": "2026-04-08", "o": 91.985, "c": 88.9, "h": 93.9, "l": 87.45, "v": 19538594.96819}, {"date": "2026-04-09", "o": 90.4, "c": 92, "h": 94.96, "l": 84.81, "v": 65533290.046646}, {"date": "2026-04-10", "o": 93.44, "c": 102, "h": 105.9, "l": 93.2, "v": 83416527.779682}, {"date": "2026-04-13", "o": 104.225, "c": 110.27, "h": 114.1, "l": 103.87, "v": 56011105.763604}, {"date": "2026-04-14", "o": 114.945, "c": 117.2, "h": 119.06, "l": 112.91, "v": 46585995.364071}, {"date": "2026-04-15", "o": 119.83, "c": 118.69, "h": 121.37, "l": 113.87, "v": 43324937.477165}, {"date": "2026-04-16", "o": 119.98, "c": 119.56, "h": 122.14, "l": 114.8, "v": 28917571.095666}, {"date": "2026-04-17", "o": 120.385, "c": 116.85, "h": 120.69, "l": 115.99, "v": 24685920.76259}, {"date": "2026-04-20", "o": 116.18, "c": 117.43, "h": 118.08, "l": 110.6, "v": 29542371.123468}, {"date": "2026-04-21", "o": 118.3, "c": 115.16, "h": 120.82, "l": 113.8, "v": 18656061.193347}, {"date": "2026-04-22", "o": 118.3, "c": 122.54, "h": 124.96, "l": 117.575, "v": 31878211.704454}, {"date": "2026-04-23", "o": 122.1, "c": 117.42, "h": 124.2, "l": 116.15, "v": 21696230.465932}, {"date": "2026-04-24", "o": 120.97, "c": 110.14, "h": 121, "l": 106.51, "v": 33898207.899386}, {"date": "2026-04-27", "o": 109.87, "c": 112.06, "h": 112.82, "l": 104.93, "v": 24928955.41159}, {"date": "2026-04-28", "o": 103.6, "c": 105.53, "h": 110, "l": 103.05, "v": 27765202.347744}, {"date": "2026-04-29", "o": 108.195, "c": 114.19, "h": 115.47, "l": 107.05, "v": 27754006.392329}, {"date": "2026-04-30", "o": 117.29, "c": 111.6, "h": 118.25, "l": 111.18, "v": 25279771.770761}, {"date": "2026-05-01", "o": 114.11, "c": 119.01, "h": 121.855, "l": 113.14, "v": 27413038.952277}, {"date": "2026-05-04", "o": 121.18, "c": 125.43, "h": 129.97, "l": 121.17, "v": 30197252.520326}, {"date": "2026-05-05", "o": 125, "c": 127.89, "h": 129.52, "l": 122.5242, "v": 22972750.389385}, {"date": "2026-05-06", "o": 131.075, "c": 137.98, "h": 138.25, "l": 130.41, "v": 31677917.196753}, {"date": "2026-05-07", "o": 132.055, "c": 128.84, "h": 133.5889, "l": 125.43, "v": 41365344.151812}, {"date": "2026-05-08", "o": 118.46, "c": 114.15, "h": 123.75, "l": 110.5501, "v": 48479367.828858}, {"date": "2026-05-11", "o": 112.02, "c": 114.7, "h": 119.49, "l": 111.5, "v": 27701915.360403}, {"date": "2026-05-12", "o": 110.79, "c": 107.75, "h": 110.98, "l": 101.12, "v": 32879127.486981}, {"date": "2026-05-13", "o": 112.95, "c": 111.31, "h": 112.98, "l": 106.34, "v": 23597982.087823}, {"date": "2026-05-14", "o": 111.53, "c": 114.215, "h": 118.21, "l": 110.0601, "v": 27702282.367019}, {"date": "2026-05-15", "o": 109.415, "c": 107.3, "h": 110.36, "l": 106.44, "v": 22048173.702773}, {"date": "2026-05-18", "o": 106.785, "c": 103.77, "h": 106.95, "l": 98.65, "v": 38653678.265061}, {"date": "2026-05-19", "o": 98.53, "c": 99.81, "h": 101.31, "l": 94.82, "v": 29845564.316169}, {"date": "2026-05-20", "o": 101.5, "c": 101.28, "h": 102.75, "l": 98.1, "v": 21656792.674598}, {"date": "2026-05-21", "o": 106.56, "c": 107.58, "h": 108.44, "l": 103.161, "v": 31898627.91911}, {"date": "2026-05-22", "o": 109.32, "c": 105.49, "h": 109.85, "l": 104.8802, "v": 20001619.535672}, {"date": "2026-05-26", "o": 108.24, "c": 105.89, "h": 109.2, "l": 105, "v": 21456077.718342}, {"date": "2026-05-27", "o": 105.11, "c": 104.27, "h": 105.55, "l": 99.6, "v": 24155028.283736}, {"date": "2026-05-28", "o": 107.95, "c": 106.86, "h": 110.33, "l": 103.63, "v": 23405961.680451}, {"date": "2026-05-29", "o": 108.02, "c": 109.53, "h": 110.25, "l": 102.3, "v": 28158221.632705}, {"date": "2026-06-01", "o": 114.775, "c": 124.82, "h": 127.8485, "l": 114.715, "v": 58297282.359708}, {"date": "2026-06-02", "o": 129.96, "c": 119.27, "h": 132.15, "l": 118.82, "v": 34813977.312362}, {"date": "2026-06-03", "o": 119.915, "c": 110.93, "h": 121.96, "l": 110.55, "v": 26460067.801545}, {"date": "2026-06-04", "o": 107.49, "c": 108.03, "h": 110.45, "l": 105.03, "v": 26751963.891359}, {"date": "2026-06-05", "o": 104.635, "c": 100.39, "h": 104.8, "l": 95.5401, "v": 32460769.040956}, {"date": "2026-06-08", "o": 102.03, "c": 102.37, "h": 104.3, "l": 98.4, "v": 23379818.976385}, {"date": "2026-06-09", "o": 103.99, "c": 98.45, "h": 105.385, "l": 93.6, "v": 26865595.552986}, {"date": "2026-06-10", "o": 95.39, "c": 95.61, "h": 100.51, "l": 95.1, "v": 17855641.668368}, {"date": "2026-06-11", "o": 92.635, "c": 95.74, "h": 96.51, "l": 91.02, "v": 22683488.057536}, {"date": "2026-06-12", "o": 99.12, "c": 100.55, "h": 105.55, "l": 97.22, "v": 36338090.014948}]

outputs/phase3_p6_direction_classify_v1.md

### CRCL (n_long=32  n_short=8)

77.6% of all outstanding Class A (157M/202.55M) and ~463% of the 34M IPO float will be unlocked in December.

### CRWV (n_long=30  n_short=12)

**[2]** pred=`99c06126-b070-4841-b998-e608eea6f07f` pub=2025-11-14 entry=2025-11-17 px=$75.51
- LLM: dir=short conv=3 hz=long_term qc=None hedged=0
- 1m: 75.51 raw=N/A excess=+10.37%
- 原文: `Neocloud isn't winner takes all, it's a whole ecosystem but not everything can become AWS.

**[4]** pred=`256e9ccc-5637-4dfb-bc41-bfd573bb950e` pub=2025-11-22 entry=2025-11-24 px=$72.95
- LLM: dir=short conv=3 hz=long_term qc=None hedged=0
- 1m: 72.95 raw=N/A excess=-4.76%
- 原文: `If you spent just 30 seconds reading the post, you would see I didn't rate $BITF.

**[7]** pred=`02e6a333-6829-4297-b77e-465b991efd58` pub=2025-12-11 entry=2025-12-12 px=$86.19
- LLM: dir=short conv=4 hz=event_driven qc=None hedged=0
- 1m: 86.19 raw=N/A excess=-4.19%
- 原文: `Oracle [ $ORCL ] earning results and its effect on the neocloud sector like $NBIS & $IREN:

**[8]** pred=`6508c55f-c3af-4737-bebc-b02bc73fa256` pub=2025-12-12 entry=2025-12-15 px=$79.33
- LLM: dir=short conv=3 hz=long_term qc=None hedged=0
- 1m: 79.33 raw=N/A excess=-19.77%
- 原文: `Broadcom [ $AVGO ] earnings results and its effect on the AI sector like $LITE and $NBIS:

**[9]** pred=`8ae273f0-77fd-4bb5-8f01-efd5ebdc63e8` pub=2026-01-28 entry=2026-01-29 px=$103.86
- LLM: dir=short conv=4 hz=long_term qc=None hedged=0
- 1m: 103.86 raw=N/A excess=+24.85%
- 原文: `Thinking about buying $CRWV on the $NVDA deal?

**[11]** pred=`a95297b0-ba35-4dbd-9675-4594ec8f91a6` pub=2026-01-28 entry=2026-01-29 px=$103.86
- LLM: dir=short conv=4 hz=long_term qc=None hedged=0
- 1m: 103.86 raw=N/A excess=+24.85%
- 原文: `$CRWV is probably the only $50B+ company I can think of that is likely going to go bankrupt. At least $ORCL has a profitable core business and owns tons of assets like  15% of Tiktok.

**[12]** pred=`69021353-dc98-4c38-8079-7c76324527da` pub=2026-03-28 entry=2026-03-30 px=$75.31
- LLM: dir=short conv=4 hz=long_term qc=None hedged=0
- 1m: 75.31 raw=N/A excess=-51.63%
- 原文: `My thoughts on $NBIS, $IREN, $CRWV and the current Neocloud market.

### POET (n_long=23  n_short=1)

**[1]** pred=`678660f3-754b-448e-a56d-e8d6bf643b28` pub=2026-04-27 entry=2026-04-28 px=$7.54
- LLM: dir=short conv=3 hz=long_term qc=None hedged=0
- 1m: 7.54 raw=N/A excess=-75.86%
- 原文: `@AD14977 I've always said $POET is the most likely to get designed out down the road.

### ULBI (n_long=0  n_short=1)

**[1]** pred=`bc170d1a-13b3-43c1-995c-7e59cd5827a7` pub=2026-01-12 entry=2026-01-13 px=$6.30
- LLM: dir=short conv=3 hz=event_driven qc=None hedged=0
- 1m: 6.3 raw=N/A excess=+0.63%
- 原文: `@_gautam94 @KawzInvests Just a heads up $ULBI has -50.3M in debt, -84.8M total accrued expenses, with $9.3M left.