data/price_cache/INFQ_FULL_HISTORY.json

[{"date": "2026-02-17", "o": 14.0501, "c": 15.59, "h": 17.51, "l": 13.01, "v": 6358527.0}, {"date": "2026-02-18", "o": 16.2, "c": 14.71, "h": 16.49, "l": 14.02, "v": 4442422.0}, {"date": "2026-02-19", "o": 15.06, "c": 13.68, "h": 15.09, "l": 12.99, "v": 4827112.0}, {"date": "2026-02-20", "o": 13.55, "c": 13.29, "h": 13.66, "l": 12.49, "v": 4033726.0}, {"date": "2026-02-23", "o": 12.8, "c": 12.49, "h": 12.9186, "l": 11.86, "v": 3134155.36897}, {"date": "2026-02-24", "o": 12.28, "c": 12.03, "h": 12.3399, "l": 11.4, "v": 4424068.063433}, {"date": "2026-02-25", "o": 11.98, "c": 13.09, "h": 13.19, "l": 11.92, "v": 3912532.354276}, {"date": "2026-02-26", "o": 13.36, "c": 12.89, "h": 14, "l": 12.68, "v": 3892578.554794}, {"date": "2026-02-27", "o": 12.17, "c": 11.64, "h": 12.4, "l": 11.265, "v": 3735299.056977}, {"date": "2026-03-02", "o": 11.3, "c": 11.92, "h": 12.19, "l": 11.29, "v": 2583179.298344}, {"date": "2026-03-03", "o": 11.3, "c": 11.81, "h": 11.89, "l": 11.03, "v": 2626430.691353}, {"date": "2026-03-04", "o": 11.71, "c": 11.8, "h": 11.95, "l": 11.36, "v": 2163784.30003}, {"date": "2026-03-05", "o": 11.59, "c": 11.21, "h": 12.0389, "l": 10.921, "v": 3033109.599839}, {"date": "2026-03-06", "o": 10.85, "c": 10.67, "h": 11.21, "l": 10.62, "v": 2544829.547468}, {"date": "2026-03-09", "o": 10.52, "c": 11.66, "h": 11.66, "l": 10.3805, "v": 3259916.359086}, {"date": "2026-03-10", "o": 11.65, "c": 12.15, "h": 12.66, "l": 11.65, "v": 3387799.945438}, {"date": "2026-03-11", "o": 12.16, "c": 11.43, "h": 12.3, "l": 11.31, "v": 2697480.83843}, {"date": "2026-03-12", "o": 11.32, "c": 10.68, "h": 11.53, "l": 10.61, "v": 2772869.914398}, {"date": "2026-03-13", "o": 10.84, "c": 10.08, "h": 11.19, "l": 10.01, "v": 3074444.667396}, {"date": "2026-03-16", "o": 10.29, "c": 10.55, "h": 10.65, "l": 10.135, "v": 2400716.460327}, {"date": "2026-03-17", "o": 10.77, "c": 10.78, "h": 11.1, "l": 10.5475, "v": 2023700.509113}, {"date": "2026-03-18", "o": 10.6, "c": 9.8, "h": 10.62, "l": 9.77, "v": 2854991.28435}, {"date": "2026-03-19", "o": 9.44, "c": 9.62, "h": 9.79, "l": 9.01, "v": 2546193.494645}, {"date": "2026-03-20", "o": 9.5, "c": 8.81, "h": 9.547, "l": 8.56, "v": 3557502.193079}, {"date": "2026-03-23", "o": 9.03, "c": 9.58, "h": 9.69, "l": 8.8, "v": 2201149.956475}, {"date": "2026-03-24", "o": 9.4, "c": 10.25, "h": 10.36, "l": 9.21, "v": 2476777.30658}, {"date": "2026-03-25", "o": 10.85, "c": 11.33, "h": 11.55, "l": 10.5, "v": 4000089.609799}, {"date": "2026-03-26", "o": 11.28, "c": 10.65, "h": 11.7701, "l": 10.6, "v": 3071582.084623}, {"date": "2026-03-27", "o": 10.4, "c": 9.85, "h": 10.4, "l": 9.66, "v": 2864193.189868}, {"date": "2026-03-30", "o": 9.85, "c": 8.92, "h": 9.9, "l": 8.52, "v": 3074215.957284}, {"date": "2026-03-31", "o": 9.13, "c": 9.81, "h": 9.8199, "l": 9.11, "v": 2043096.091661}, {"date": "2026-04-01", "o": 9.92, "c": 9.41, "h": 10.09, "l": 9.33, "v": 2218430.675215}, {"date": "2026-04-02", "o": 9.03, "c": 10.57, "h": 10.6, "l": 9, "v": 2539511.613678}, {"date": "2026-04-06", "o": 10.64, "c": 10.45, "h": 11.12, "l": 10.42, "v": 1660682.95109}, {"date": "2026-04-07", "o": 10.27, "c": 10.04, "h": 10.33, "l": 9.79, "v": 1938753.53321}, {"date": "2026-04-08", "o": 10.89, "c": 11.32, "h": 11.48, "l": 10.675, "v": 2691495.6191}, {"date": "2026-04-09", "o": 11.3, "c": 11.89, "h": 12.67, "l": 11.3, "v": 5115313.567189}, {"date": "2026-04-10", "o": 12.45, "c": 12.59, "h": 12.71, "l": 11.5, "v": 5104509.271728}, {"date": "2026-04-13", "o": 12.36, "c": 12.59, "h": 12.87, "l": 11.938, "v": 3121364.647188}, {"date": "2026-04-14", "o": 13.26, "c": 14.12, "h": 14.23, "l": 12.62, "v": 9589819.427612}, {"date": "2026-04-15", "o": 15, "c": 15, "h": 15.1, "l": 13.862, "v": 12688110.604579}, {"date": "2026-04-16", "o": 15.695, "c": 15.57, "h": 15.8, "l": 14, "v": 13464703.119602}, {"date": "2026-04-17", "o": 16.2, "c": 17.42, "h": 21.28, "l": 15.87, "v": 34659622.688404}, {"date": "2026-04-20", "o": 16.9, "c": 16, "h": 19.16, "l": 15.7, "v": 29797662.842285}, {"date": "2026-04-21", "o": 15.68, "c": 15.01, "h": 15.8, "l": 14.68, "v": 15184621.245397}, {"date": "2026-04-22", "o": 15.07, "c": 14.85, "h": 15.7, "l": 14.37, "v": 13848460.382154}, {"date": "2026-04-23", "o": 14.62, "c": 13.96, "h": 15.88, "l": 13.18, "v": 14816960.180321}, {"date": "2026-04-24", "o": 14.01, "c": 13.27, "h": 14.28, "l": 13.05, "v": 10195257.235641}, {"date": "2026-04-27", "o": 13.05, "c": 13.3, "h": 13.83, "l": 12.76, "v": 8279444.739982}, {"date": "2026-04-28", "o": 12.78, "c": 12.62, "h": 13, "l": 12.3, "v": 7646726.092534}, {"date": "2026-04-29", "o": 12.41, "c": 12.06, "h": 12.48, "l": 11.75, "v": 6384336.156706}, {"date": "2026-04-30", "o": 12.005, "c": 11.89, "h": 12.48, "l": 11.6101, "v": 7004183.993004}, {"date": "2026-05-01", "o": 11.99, "c": 12.41, "h": 12.41, "l": 11.3497, "v": 7529350.633214}, {"date": "2026-05-04", "o": 12.43, "c": 12.28, "h": 12.83, "l": 12.02, "v": 8800365.77896}, {"date": "2026-05-05", "o": 12.41, "c": 12.1, "h": 12.59, "l": 11.48, "v": 6635824.403398}, {"date": "2026-05-06", "o": 12.4, "c": 13.55, "h": 13.74, "l": 12.3311, "v": 9500133.389212}, {"date": "2026-05-07", "o": 13.25, "c": 12.11, "h": 13.3, "l": 12.045, "v": 7090618.075404}, {"date": "2026-05-08", "o": 12.26, "c": 12.12, "h": 12.4481, "l": 11.57, "v": 5864090.088851}, {"date": "2026-05-11", "o": 11.87, "c": 12.84, "h": 13.18, "l": 11.6, "v": 7544149.65516}, {"date": "2026-05-12", "o": 12.99, "c": 13.1, "h": 13.63, "l": 12.49, "v": 10659723.515115}, {"date": "2026-05-13", "o": 13.31, "c": 13.29, "h": 13.75, "l": 13.015, "v": 9067686.961971}, {"date": "2026-05-14", "o": 13.33, "c": 13.97, "h": 14.3282, "l": 12.76, "v": 12353332.230182}, {"date": "2026-05-15", "o": 12.88, "c": 12.44, "h": 13.16, "l": 12.11, "v": 11697379.065253}, {"date": "2026-05-18", "o": 12.65, "c": 11.37, "h": 12.753, "l": 10.9492, "v": 12068957.6743}, {"date": "2026-05-19", "o": 11.07, "c": 10.63, "h": 11.34, "l": 10.32, "v": 7308881.727468}, {"date": "2026-05-20", "o": 10.65, "c": 11.18, "h": 11.29, "l": 10.45, "v": 6638189.405456}, {"date": "2026-05-21", "o": 13.5, "c": 14.7, "h": 16.09, "l": 13.39, "v": 78638214.874513}, {"date": "2026-05-22", "o": 15.9, "c": 16.35, "h": 18.2, "l": 15.71, "v": 65623640.945645}, {"date": "2026-05-26", "o": 16.48, "c": 15.88, "h": 16.65, "l": 14.93, "v": 33591921.35819}, {"date": "2026-05-27", "o": 15.995, "c": 15.46, "h": 16.41, "l": 14.66, "v": 25437867.321626}, {"date": "2026-05-28", "o": 15.82, "c": 17.77, "h": 18.25, "l": 15.5, "v": 38025186.895143}, {"date": "2026-05-29", "o": 17.5, "c": 16.22, "h": 17.59, "l": 15.61, "v": 29498635.750403}, {"date": "2026-06-01", "o": 16.01, "c": 17.69, "h": 18.57, "l": 15.73, "v": 29339422.70538}, {"date": "2026-06-02", "o": 18.305, "c": 19.87, "h": 20.75, "l": 18, "v": 31989569.926542}, {"date": "2026-06-03", "o": 18.75, "c": 17.41, "h": 19.06, "l": 17.25, "v": 25226119.57299}, {"date": "2026-06-04", "o": 17.01, "c": 16.95, "h": 18.07, "l": 16.64, "v": 16143567.768766}, {"date": "2026-06-05", "o": 16.16, "c": 14.56, "h": 16.4, "l": 14.3, "v": 19441439.93221}, {"date": "2026-06-08", "o": 15.17, "c": 14.81, "h": 15.44, "l": 14.35, "v": 14234238.660803}, {"date": "2026-06-09", "o": 14.97, "c": 13.71, "h": 15.48, "l": 13.15, "v": 15810511.884673}, {"date": "2026-06-10", "o": 13.72, "c": 13.58, "h": 14.73, "l": 13.56, "v": 10732549.176764}, {"date": "2026-06-11", "o": 13.51, "c": 14.12, "h": 14.2996, "l": 13.22, "v": 10946935.441289}, {"date": "2026-06-12", "o": 14.09, "c": 13.42, "h": 14.39, "l": 13.35, "v": 11257184.032771}]

outputs/phase3_p6_direction_classify_v1.md

### BMNR (n_long=1  n_short=12)

**[11]** pred=`5e3d3160-3bc9-454b-a47e-f1de477dcd63` pub=2026-02-02 entry=2026-02-03 px=$23.09
- LLM: dir=short conv=3 hz=event_driven qc=None hedged=0
- 1m: 23.09 raw=N/A excess=+11.87%
- 原文: `Markets are seeing liquidation cascades.

### CRWV (n_long=30  n_short=12)

But AVGO dropped -11.64% and brought down the AI sector.

Bet on the house, not the one with $14.7B+ in debt with $1.2B+ in yearly interest payments.`

### DUOL (n_long=4  n_short=2)

**[2]** pred=`cbe3b639-3855-4db0-82c8-fcc33060c0bb` pub=2026-02-17 entry=2026-02-18 px=$112.01
- LLM: dir=short conv=3 hz=3m qc=None hedged=0
- 1m: 112.01 raw=N/A excess=+11.07%
- 原文: `This data is alarming... Robinhood users lost a collective:

### IREN (n_long=74  n_short=24)

**[5]** pred=`1bd3cadd-0620-4bb6-9834-4597ea0a17c8` pub=2025-11-19 entry=2025-11-20 px=$48.97
- LLM: dir=short conv=4 hz=event_driven qc=None hedged=0
- 1m: 48.97 raw=N/A excess=+14.09%
- 原文: `Sure happy to explain further than the TLDR on why I've downgraded $IREN and upgraded $TSSI a strong buy.  $TSSI has high upside on the drop from $30 to $7 since it was an overreaction to temporary Q3 operational scaling bottlenecks and factory cost not underlying demand.

Especially given the new $6B share dilution at a $12.8B marketcap.

**[20]** pred=`1f41fa44-cb23-4c68-8cd6-796fb67aafa3` pub=2026-04-23 entry=2026-04-24 px=$53.24
- LLM: dir=short conv=3 hz=event_driven qc=None hedged=0
- 1m: 53.24 raw=N/A excess=-12.28%
- 原文: `@BitcoinAIGuy I’m still bearish on $IREN due to $6B ATM overhang, even if there’s rumors they’re doing colo. I was long last year you know.`

### ORCL (n_long=12  n_short=6)

But AVGO dropped -11.64% and brought down the AI sector.