data/price_cache/CCCX_FULL_HISTORY.json

[{"date": "2025-07-07", "o": 10.48, "c": 10.22, "h": 10.48, "l": 10.185, "v": 10995}, {"date": "2025-07-08", "o": 10.2, "c": 10.16, "h": 10.2, "l": 10.16, "v": 480682}, {"date": "2025-07-09", "o": 10.17, "c": 10.17, "h": 10.17, "l": 10.165, "v": 45757}, {"date": "2025-07-10", "o": 10.16, "c": 10.15, "h": 10.16, "l": 10.15, "v": 26994}, {"date": "2025-07-11", "o": 10.16, "c": 10.15, "h": 10.16, "l": 10.15, "v": 1456137.0}, {"date": "2025-07-14", "o": 10.1, "c": 10.11, "h": 10.15, "l": 10.1, "v": 65780}, {"date": "2025-07-15", "o": 10.15, "c": 10.1, "h": 10.1502, "l": 10.03, "v": 533510}, {"date": "2025-07-16", "o": 10.12, "c": 10.12, "h": 10.12, "l": 10.12, "v": 575}, {"date": "2025-07-17", "o": 10.12, "c": 10.135, "h": 10.15, "l": 10.12, "v": 62745}, {"date": "2025-07-18", "o": 10.1378, "c": 10.12, "h": 10.16, "l": 10.12, "v": 174001}, {"date": "2025-07-21", "o": 10.16, "c": 10.16, "h": 10.16, "l": 10.11, "v": 179406}, {"date": "2025-07-22", "o": 10.1547, "c": 10.15, "h": 10.1581, "l": 10.14, "v": 61945}, {"date": "2025-07-23", "o": 10.16, "c": 10.16, "h": 10.16, "l": 10.14, "v": 118753}, {"date": "2025-07-24", "o": 10.1539, "c": 10.1552, "h": 10.16, "l": 10.15, "v": 647367}, {"date": "2025-07-25", "o": 10.1435, "c": 10.16, "h": 10.16, "l": 10.1435, "v": 1261}, {"date": "2025-07-28", "o": 10.16, "c": 10.16, "h": 10.16, "l": 10.15, "v": 105403}, {"date": "2025-07-29", "o": 10.15, "c": 10.16, "h": 10.16, "l": 10.15, "v": 30024}, {"date": "2025-07-30", "o": 10.14, "c": 10.16, "h": 10.16, "l": 10.14, "v": 93213}, {"date": "2025-07-31", "o": 10.15, "c": 10.145, "h": 10.16, "l": 10.14, "v": 45216}, {"date": "2025-08-01", "o": 10.12, "c": 10.14, "h": 10.16, "l": 10.11, "v": 55772}, {"date": "2025-08-04", "o": 10.145, "c": 10.15, "h": 10.15, "l": 10.11, "v": 116605}, {"date": "2025-08-05", "o": 10.15, "c": 10.15, "h": 10.15, "l": 10.15, "v": 50399}, {"date": "2025-08-06", "o": 10.15, "c": 10.14, "h": 10.15, "l": 10.14, "v": 1110}, {"date": "2025-08-07", "o": 10.13, "c": 10.14, "h": 10.16, "l": 10.13, "v": 30751}, {"date": "2025-08-08", "o": 10.15, "c": 10.1408, "h": 10.15, "l": 10.1408, "v": 2303}, {"date": "2025-08-11", "o": 10.14, "c": 10.135, "h": 10.14, "l": 10.11, "v": 146184}, {"date": "2025-08-12", "o": 10.12, "c": 10.13, "h": 10.14, "l": 10.12, "v": 18460}, {"date": "2025-08-13", "o": 10.1441, "c": 10.12, "h": 10.1441, "l": 10.12, "v": 25735}, {"date": "2025-08-14", "o": 10.13, "c": 10.125, "h": 10.13, "l": 10.12, "v": 161274}, {"date": "2025-08-15", "o": 10.12, "c": 10.14, "h": 10.14, "l": 10.12, "v": 101048}, {"date": "2025-08-18", "o": 10.14, "c": 10.12, "h": 10.14, "l": 10.12, "v": 2651}, {"date": "2025-08-19", "o": 10.11, "c": 10.105, "h": 10.13, "l": 10.1, "v": 45194}, {"date": "2025-08-20", "o": 10.1, "c": 10.13, "h": 10.15, "l": 10.1, "v": 364133}, {"date": "2025-08-21", "o": 10.14, "c": 10.125, "h": 10.14, "l": 10.12, "v": 18615}, {"date": "2025-08-22", "o": 10.13, "c": 10.12, "h": 10.13, "l": 10.12, "v": 1729}, {"date": "2025-08-25", "o": 10.11, "c": 10.11, "h": 10.1108, "l": 10.1, "v": 9477}, {"date": "2025-08-26", "o": 10.1, "c": 10.115, "h": 10.13, "l": 10.1, "v": 7047}, {"date": "2025-08-27", "o": 10.11, "c": 10.1, "h": 10.12, "l": 10.1, "v": 38831}, {"date": "2025-08-28", "o": 10.1, "c": 10.1, "h": 10.1, "l": 10.1, "v": 13549}, {"date": "2025-08-29", "o": 10.12, "c": 10.12, "h": 10.12, "l": 10.11, "v": 70326}, {"date": "2025-09-02", "o": 10.12, "c": 10.115, "h": 10.13, "l": 10.115, "v": 47396}, {"date": "2025-09-03", "o": 10.12, "c": 10.115, "h": 10.12, "l": 10.11, "v": 177899}, {"date": "2025-09-04", "o": 10.12, "c": 10.11, "h": 10.12, "l": 10.11, "v": 2490}, {"date": "2025-09-05", "o": 10.12, "c": 10.12, "h": 10.12, "l": 10.12, "v": 3282}, {"date": "2025-09-08", "o": 10.32, "c": 10.2, "h": 10.32, "l": 10.15, "v": 4082325.0}, {"date": "2025-09-09", "o": 10.24, "c": 10.26, "h": 10.3, "l": 10.22, "v": 2476642.0}, {"date": "2025-09-10", "o": 10.3, "c": 10.26, "h": 10.3, "l": 10.24, "v": 971479}, {"date": "2025-09-11", "o": 10.3, "c": 10.28, "h": 10.3, "l": 10.26, "v": 686388}, {"date": "2025-09-12", "o": 10.32, "c": 10.37, "h": 10.46, "l": 10.29, "v": 2403885.0}, {"date": "2025-09-15", "o": 10.43, "c": 10.48, "h": 10.52, "l": 10.43, "v": 2242888.0}, {"date": "2025-09-16", "o": 10.51, "c": 10.69, "h": 10.76, "l": 10.47, "v": 969430}, {"date": "2025-09-17", "o": 10.74, "c": 11.02, "h": 11.1, "l": 10.71, "v": 2153250.0}, {"date": "2025-09-18", "o": 11.14, "c": 11.25, "h": 11.38, "l": 11.1292, "v": 2499791.0}, {"date": "2025-09-19", "o": 11.65, "c": 12.17, "h": 12.255, "l": 11.5775, "v": 5752108.0}, {"date": "2025-09-22", "o": 12.5, "c": 12.31, "h": 12.82, "l": 12.1, "v": 2983861.0}, {"date": "2025-09-23", "o": 12.49, "c": 12.67, "h": 12.98, "l": 12.32, "v": 3173547.0}, {"date": "2025-09-24", "o": 12.8, "c": 13.5, "h": 13.68, "l": 12.63, "v": 4339780.0}, {"date": "2025-09-25", "o": 12.86, "c": 13.34, "h": 13.8, "l": 12.56, "v": 3384235.0}, {"date": "2025-09-26", "o": 13.49, "c": 13.5, "h": 13.68, "l": 12.72, "v": 2834710.0}, {"date": "2025-09-29", "o": 13.7, "c": 13.09, "h": 13.7, "l": 12.9, "v": 1594782.0}, {"date": "2025-09-30", "o": 13.16, "c": 12.86, "h": 13.38, "l": 12.46, "v": 2247438.0}, {"date": "2025-10-01", "o": 12.8, "c": 12.89, "h": 13.1, "l": 12.76, "v": 1213151.0}, {"date": "2025-10-02", "o": 12.98, "c": 13.3, "h": 13.31, "l": 12.83, "v": 1577912.0}, {"date": "2025-10-03", "o": 13.82, "c": 14.45, "h": 14.9, "l": 13.5, "v": 7131062.0}, {"date": "2025-10-06", "o": 15.75, "c": 15.99, "h": 17.19, "l": 14.81, "v": 11372463.0}, {"date": "2025-10-07", "o": 17.5, "c": 18.23, "h": 19.14, "l": 16.27, "v": 12917215.0}, {"date": "2025-10-08", "o": 19.27, "c": 19.29, "h": 21.6, "l": 18.48, "v": 11438608.0}, {"date": "2025-10-09", "o": 20.36, "c": 21.59, "h": 22.04, "l": 19.82, "v": 7961253.0}, {"date": "2025-10-10", "o": 24.195, "c": 22.41, "h": 25.5, "l": 19.29, "v": 17069894.0}, {"date": "2025-10-13", "o": 24.33, "c": 25.95, "h": 27.19, "l": 23.11, "v": 7946819.0}, {"date": "2025-10-14", "o": 26.55, "c": 24.33, "h": 27.5, "l": 23.82, "v": 7817384.0}, {"date": "2025-10-15", "o": 26, "c": 22.9, "h": 26.49, "l": 20.66, "v": 9839772.0}, {"date": "2025-10-16", "o": 23.89, "c": 19.74, "h": 24.16, "l": 18.9, "v": 9161518.0}, {"date": "2025-10-17", "o": 19.7, "c": 21.1, "h": 21.68, "l": 18.08, "v": 7610950.0}, {"date": "2025-10-20", "o": 21.63, "c": 21.5, "h": 22.28, "l": 19.56, "v": 5831421.0}, {"date": "2025-10-21", "o": 21.19, "c": 18.61, "h": 21.7658, "l": 18.5, "v": 6095358.0}, {"date": "2025-10-22", "o": 17.87, "c": 16.98, "h": 17.95, "l": 13.84, "v": 14102122.0}, {"date": "2025-10-23", "o": 18.175, "c": 19.58, "h": 19.77, "l": 17.45, "v": 8623845.0}, {"date": "2025-10-24", "o": 20.54, "c": 20.49, "h": 22.23, "l": 19.7, "v": 5491701.0}, {"date": "2025-10-27", "o": 21.675, "c": 21.34, "h": 23.17, "l": 20.8, "v": 6060784.0}, {"date": "2025-10-28", "o": 21.44, "c": 20.33, "h": 24.22, "l": 18.71, "v": 15361146.0}, {"date": "2025-10-29", "o": 20.35, "c": 19.48, "h": 20.9, "l": 18.6, "v": 5092826.0}, {"date": "2025-10-30", "o": 18.5, "c": 17.86, "h": 19.59, "l": 17.76, "v": 4508911.0}, {"date": "2025-10-31", "o": 18.64, "c": 19.26, "h": 19.59, "l": 18.26, "v": 3420102.0}, {"date": "2025-11-03", "o": 19.32, "c": 17.37, "h": 19.49, "l": 17, "v": 3296266.0}, {"date": "2025-11-04", "o": 16.3, "c": 15.51, "h": 17.35, "l": 14.8901, "v": 4222158.0}, {"date": "2025-11-05", "o": 16.9, "c": 18.47, "h": 18.99, "l": 16.1, "v": 5169689.0}, {"date": "2025-11-06", "o": 18.8, "c": 17.72, "h": 18.94, "l": 17.23, "v": 2504849.0}, {"date": "2025-11-07", "o": 16.63, "c": 18.68, "h": 18.75, "l": 16.2, "v": 3055998.0}, {"date": "2025-11-10", "o": 18.94, "c": 17.33, "h": 19.05, "l": 17.11, "v": 2706993.0}, {"date": "2025-11-11", "o": 16.75, "c": 17.67, "h": 18.58, "l": 16.6, "v": 2344266.0}, {"date": "2025-11-12", "o": 17.67, "c": 17.12, "h": 19.25, "l": 16.86, "v": 3796130.0}, {"date": "2025-11-13", "o": 17, "c": 16.06, "h": 17.15, "l": 15.75, "v": 4273032.0}, {"date": "2025-11-14", "o": 15.48, "c": 15.97, "h": 16.85, "l": 15.31, "v": 3226492.0}, {"date": "2025-11-17", "o": 15.63, "c": 14.79, "h": 16.35, "l": 14.45, "v": 3313552.0}, {"date": "2025-11-18", "o": 14.45, "c": 14.57, "h": 15.15, "l": 13.68, "v": 3888099.0}, {"date": "2025-11-19", "o": 14.59, "c": 14.51, "h": 15.24, "l": 14.2501, "v": 1929405.0}, {"date": "2025-11-20", "o": 15.28, "c": 13.23, "h": 15.45, "l": 13, "v": 3563304.0}, {"date": "2025-11-21", "o": 13.65, "c": 13.37, "h": 14.39, "l": 13.14, "v": 2395558.0}, {"date": "2025-11-24", "o": 13.68, "c": 14, "h": 14.29, "l": 13.57, "v": 1962563.0}, {"date": "2025-11-25", "o": 13.85, "c": 13.775, "h": 14.07, "l": 13.43, "v": 1288475.0}, {"date": "2025-11-26", "o": 13.78, "c": 13.83, "h": 14.11, "l": 13.63, "v": 1135424.0}, {"date": "2025-11-28", "o": 14.15, "c": 14.75, "h": 15.23, "l": 14, "v": 1277275.0}, {"date": "2025-12-01", "o": 14.89, "c": 13.93, "h": 14.89, "l": 13.8801, "v": 1418227.0}, {"date": "2025-12-02", "o": 13.75, "c": 14.46, "h": 14.59, "l": 13.6801, "v": 2011324.0}, {"date": "2025-12-03", "o": 14.58, "c": 14.65, "h": 15.32, "l": 14.06, "v": 1653213.0}, {"date": "2025-12-04", "o": 14.65, "c": 15.28, "h": 16.07, "l": 14.51, "v": 3417191.0}, {"date": "2025-12-05", "o": 15.4, "c": 14.51, "h": 15.45, "l": 14.5, "v": 1281469.0}, {"date": "2025-12-08", "o": 14.85, "c": 14.45, "h": 15, "l": 14.25, "v": 1088194.0}, {"date": "2025-12-09", "o": 14.59, "c": 14.41, "h": 14.93, "l": 14.17, "v": 801676}, {"date": "2025-12-10", "o": 14.44, "c": 14.01, "h": 14.56, "l": 14, "v": 967298}, {"date": "2025-12-11", "o": 14.03, "c": 14.68, "h": 15.26, "l": 13.8201, "v": 1697709.0}, {"date": "2025-12-12", "o": 15.14, "c": 14.91, "h": 15.78, "l": 14.65, "v": 2213244.0}, {"date": "2025-12-15", "o": 15.18, "c": 14, "h": 15.22, "l": 13.85, "v": 1645273.0}, {"date": "2025-12-16", "o": 13.75, "c": 13.79, "h": 14.18, "l": 13.03, "v": 1964317.0}, {"date": "2025-12-17", "o": 13.84, "c": 13.42, "h": 14.1943, "l": 13.1, "v": 908855}, {"date": "2025-12-18", "o": 13.65, "c": 13.34, "h": 13.75, "l": 13.1, "v": 873386}, {"date": "2025-12-19", "o": 13.35, "c": 13.85, "h": 14.58, "l": 13.12, "v": 2393458.0}, {"date": "2025-12-22", "o": 14.32, "c": 15.72, "h": 16, "l": 14.15, "v": 3751603.0}, {"date": "2025-12-23", "o": 15.97, "c": 17.27, "h": 17.85, "l": 15.75, "v": 4090367.0}, {"date": "2025-12-24", "o": 17.99, "c": 17.95, "h": 18.24, "l": 17.3, "v": 1690189.0}, {"date": "2025-12-26", "o": 18.5, "c": 17.52, "h": 18.6199, "l": 17.35, "v": 1953589.0}, {"date": "2025-12-29", "o": 16.28, "c": 16.38, "h": 17.22, "l": 16.12, "v": 1724283.0}, {"date": "2025-12-30", "o": 16.2, "c": 15.76, "h": 16.35, "l": 15.67, "v": 1309060.0}, {"date": "2025-12-31", "o": 15.87, "c": 15.6, "h": 16.18, "l": 15.52, "v": 1126548.0}, {"date": "2026-01-02", "o": 15.87, "c": 17.14, "h": 17.15, "l": 15.85, "v": 1736552.0}, {"date": "2026-01-05", "o": 17.44, "c": 18.61, "h": 18.8171, "l": 16.82, "v": 3619962.0}, {"date": "2026-01-06", "o": 18.92, "c": 17, "h": 19, "l": 16.9, "v": 2964241.0}, {"date": "2026-01-07", "o": 17.21, "c": 17.95, "h": 18.25, "l": 16.64, "v": 1895661.0}, {"date": "2026-01-08", "o": 17.88, "c": 19.38, "h": 19.54, "l": 17.5, "v": 3536278.0}, {"date": "2026-01-09", "o": 19.5, "c": 18.8, "h": 19.94, "l": 18.72, "v": 1928626.0}, {"date": "2026-01-12", "o": 18.5, "c": 18.62, "h": 19.73, "l": 18.3, "v": 1377384.0}, {"date": "2026-01-13", "o": 18.74, "c": 18.06, "h": 19, "l": 17.17, "v": 2379758.0}, {"date": "2026-01-14", "o": 17.94, "c": 17.3, "h": 18.32, "l": 17.05, "v": 1427886.0}, {"date": "2026-01-15", "o": 17.3, "c": 17.17, "h": 18.4, "l": 17.15, "v": 1364183.0}, {"date": "2026-01-16", "o": 17, "c": 17.25, "h": 18.19, "l": 16.71, "v": 1275710.0}, {"date": "2026-01-20", "o": 16.495, "c": 16.04, "h": 17.2799, "l": 15.68, "v": 1722041.0}, {"date": "2026-01-21", "o": 16.25, "c": 16.26, "h": 16.98, "l": 16, "v": 1430583.0}, {"date": "2026-01-22", "o": 16.6, "c": 17.37, "h": 17.9299, "l": 16.53, "v": 1554266.0}, {"date": "2026-01-23", "o": 17.25, "c": 17.35, "h": 17.99, "l": 17, "v": 983928}, {"date": "2026-01-26", "o": 18.125, "c": 16.64, "h": 18.25, "l": 16.36, "v": 1492727.0}, {"date": "2026-01-27", "o": 16.82, "c": 16.93, "h": 17.33, "l": 16.61, "v": 908833}, {"date": "2026-01-28", "o": 16.85, "c": 16.36, "h": 17, "l": 16.01, "v": 1297281.0}, {"date": "2026-01-29", "o": 16.62, "c": 15.46, "h": 16.8, "l": 15.31, "v": 1553284.0}, {"date": "2026-01-30", "o": 15.11, "c": 13.5, "h": 15.31, "l": 13.21, "v": 2542105.0}, {"date": "2026-02-02", "o": 13.55, "c": 14, "h": 14, "l": 12.98, "v": 1770120.0}, {"date": "2026-02-03", "o": 14.5, "c": 14.33, "h": 15.39, "l": 13.76, "v": 2021596.0}, {"date": "2026-02-04", "o": 14.39, "c": 12.69, "h": 14.77, "l": 12.51, "v": 2366542.0}, {"date": "2026-02-05", "o": 12.36, "c": 10.74, "h": 12.63, "l": 10.68, "v": 4900045.0}, {"date": "2026-02-06", "o": 11.31, "c": 11.66, "h": 11.82, "l": 10.85, "v": 3923084.0}, {"date": "2026-02-09", "o": 11.88, "c": 11, "h": 12.1313, "l": 10.8335, "v": 3364201.0}, {"date": "2026-02-10", "o": 12.29, "c": 12.665, "h": 13.64, "l": 12.01, "v": 7163128.0}, {"date": "2026-02-11", "o": 13.635, "c": 14.35, "h": 14.49, "l": 12.55, "v": 4079159.0}, {"date": "2026-02-12", "o": 13.75, "c": 13.215, "h": 14.5, "l": 12.33, "v": 3003384.0}, {"date": "2026-02-13", "o": 13.5, "c": 13.66, "h": 14, "l": 12.8, "v": 3288476.0}]

outputs/phase3_p6_direction_classify_v1.md

### CRWV (n_long=30  n_short=12)

**[2]** pred=`99c06126-b070-4841-b998-e608eea6f07f` pub=2025-11-14 entry=2025-11-17 px=$75.51
- LLM: dir=short conv=3 hz=long_term qc=None hedged=0
- 1m: 75.51 raw=N/A excess=+10.37%
- 原文: `Neocloud isn't winner takes all, it's a whole ecosystem but not everything can become AWS.

**[8]** pred=`6508c55f-c3af-4737-bebc-b02bc73fa256` pub=2025-12-12 entry=2025-12-15 px=$79.33
- LLM: dir=short conv=3 hz=long_term qc=None hedged=0
- 1m: 79.33 raw=N/A excess=-19.77%
- 原文: `Broadcom [ $AVGO ] earnings results and its effect on the AI sector like $LITE and $NBIS:

Bet on the house, not the one with $14.7B+ in debt with $1.2B+ in yearly interest payments.`

### IREN (n_long=74  n_short=24)

Especially given the new $6B share dilution at a $12.8B marketcap.

**[22]** pred=`998837a8-6aa5-4b26-92bf-a1959fa87021` pub=2026-05-07 entry=2026-05-08 px=$63.84
- LLM: dir=short conv=4 hz=long_term qc=None hedged=0
- 1m: 63.845 raw=N/A excess=+15.39%
- 原文: `I still am bearish on $IREN.

### NVO (n_long=4  n_short=1)

**[1]** pred=`ce9f007c-206f-46d2-a830-972ba11e8b3e` pub=2026-01-18 entry=2026-01-20 px=$60.22
- LLM: dir=short conv=3 hz=event_driven qc=None hedged=0
- 1m: 60.215 raw=N/A excess=+19.54%
- 原文: `I'm a bull that's excited about Greenland trade tensions.

### RGTI (n_long=1  n_short=9)

**[9]** pred=`4cf601e4-e68d-4cb0-85ea-95b5a43951e4` pub=2026-02-02 entry=2026-02-03 px=$18.24
- LLM: dir=short conv=3 hz=event_driven qc=None hedged=0
- 1m: 18.24 raw=N/A excess=+6.96%
- 原文: `Markets are seeing liquidation cascades.